topic,keywords,corr_with_sentiment
topic_0,"account, like, inquire, saving, overdraft, fraud",0.34122305071506487
topic_1,"report, writing, issue, suspicious, unauthorized, pending",-0.04039127563532435
topic_2,"correctly, recent, processed, fraud, overdraft, deposit",-0.0514906182172064
topic_3,"hold, need, transaction, high, value, erroneous",-0.258176012967383
topic_4,"fund, insufficient, disputed, approved, deposit, overdraft",-0.08336784235906232
topic_5,"transaction, need, hold, urgent, successful, declined",0.015024384747113038
